input,showas
10TH COUNCIL DISTRICT WSC,10TH COUNCIL DISTRICT WOMEN'S STEERING COMMITTEE
10TH DISTRICT WOMENS STEERING,10TH COUNCIL DISTRICT WOMEN'S STEERING COMMITTEE
1736 FAMILY CRISIS CENTER INC,1736 FAMILY CRISIS CENTER
2 PLUS 2 PARTNERS,2 PLUS 2 PARTNERS INC.
LACMTA,LOS ANGELES COUNTY METROPOLITAN TRANSPORTATION AUTHORITY
LOS ANGELES COUNTY METROPOLITAN TRANSPORTATION,LOS ANGELES COUNTY METROPOLITAN TRANSPORTATION AUTHORITY
LOS ANGELES COMMUNITY COLLEGE,LOS ANGELES COMMUNITY COLLEGE DISTRICT
THE GLUE LLC,"THE GLUE, LLC"
3DI,3DI INC
601 FIGUEROA CO. LLC,"601 FIGUEROA CO., LLC"
"A & R TELECOM, INC.",A & R TELECOM INC
"A & R TARPAULINS, INC.",A & R TARPAULINS INC
AAA ELECTRIC MOTOR SALES & SERVICES INC,AAA ELECTRIC MOTOR SALES & SERVICE INC
AAA ELECTRIC MOTOR SALES & SERVICES INC.,AAA ELECTRIC MOTOR SALES & SERVICE INC
"AAA ELECTRIC MOTOR SALES & SERVICES, INC.",AAA ELECTRIC MOTOR SALES & SERVICE INC
ABATIX CORP,ABATIX CORP.
ABB ENTERPRISE SOFTWARE INC.,ABB ENTERPRISE SOFTWARE INC
ABET SECURITY SERVICES INC,"ABET SECURITY SERVICES, INC."
"VCA ENGINEERS, INC.","VCA ENGINEERS, INC"
EVERSOFT INC,"EVERSOFT, INC"
EVERBRIDGE INC.,"EVERBRIDGE, INC."
EVERBRIDGE INC,"EVERBRIDGE, INC."
INSIGHT PUBLIC SECTOR INC.,INSIGHT PUBLIC SECTOR INC
INSIGHT PUBLIC SECTOR,INSIGHT PUBLIC SECTOR INC
IN-N-OUT BURGER,IN-N-OUT BURGERS INC
ECIVIS INC.,ECIVIS INC
"ECIVIS, INC.",ECIVIS INC
LOS ANGELES UNIFIED SCHOOL,LOS ANGELES UNIFIED SCHOOL DISTRICT
LOS ANGELES UNIFIED SCHOOL DISTRICT - LAUSD,LOS ANGELES UNIFIED SCHOOL DISTRICT
LOS ANGELES WATERKEEPER /C,LOS ANGELES WATERKEEPER
CITY OF LOS ANGELES WORLD AIRPORTS,LOS ANGELES WORLD AIRPORTS
LOS ANGELES WORLD AIRPORT,LOS ANGELES WORLD AIRPORTS
TYLER TECHNOLOGIES INC.,TYLER TECHNOLOGIES INC
NATIONAL RAILROAD PASSENGER CORPORATION,NATIONAL RAILROAD PASSENGER CORPORATION DBA AMTRAK
"NATIONAL INSTITUTE OF GOVERNMENTAL PURCHASING,INC.","NATIONAL INSTITUTE OF GOVERNMENTAL PURCHASING, INC."
SCPPA C/O OFFICE OF THE TREASURER,SOUTHERN CALIFORNIA PUBLIC POWER AUTHORITY
SO CALIF PUBLIC PWR AUTH/SCPPA C/O OFFICE OF THE TREASURER,SOUTHERN CALIFORNIA PUBLIC POWER AUTHORITY
UNITED AIR LINES INC,UNITED AIRLINES
UNITED AIRLINES INC,UNITED AIRLINES
UNION PACIFIC RAILROAD,UNION PACIFIC RAILROAD CO /C
UNITED EXPRESS INTERNATIONAL CORP,UNITED EXPRESS INTERNATIONAL CORPORATION
UNITED EXPRESS INTERNATIONAL CORP.,UNITED EXPRESS INTERNATIONAL CORPORATION
UNITED PARCEL SERVICE INC.,"UNITED PARCEL SERVICE, INC"
UNITED RENTALS NORTHWEST INC,"UNITED RENTALS NORTHWEST, INC"
"UNITED RENTALS NORTHWEST, INC.","UNITED RENTALS NORTHWEST, INC"
UNIVERSITY OF SOUTHERN CALIFORNIA /C,UNIVERSITY OF SOUTHERN CALIFORNIA
UNIVERSITY OF SO CALIF /C,UNIVERSITY OF SOUTHERN CALIFORNIA
UNIVISION RADIO LOS ANGELES INC,UNIVISION RADIO LOS ANGELES
DELTA AIR LINES INC,"DELTA AIRLINES, INC"
DELTA AIRLINES,"DELTA AIRLINES, INC"
DELTA AIRLINES INC,"DELTA AIRLINES, INC"
DELUXE ENTERPRISES INC.,"DELUXE ENTERPRISES, INC."
DEMETRIOU DEL GUERCIO SPRINGER,"DEMETRIOU, DEL GUERCIO, SPRINGER & FRANCIS, LLP"
DEMETRIOU DEL GUERCIO SPRINGER &,"DEMETRIOU, DEL GUERCIO, SPRINGER & FRANCIS, LLP"
DELL MARKETING L P,DELL MARKETING LP
TETRA TECH INC,"TETRA TECH, INC."
TETRA TECH INC.,"TETRA TECH, INC."
"TETRA TECH, INC","TETRA TECH, INC."
REGENTS OF THE U. C.,REGENTS OF THE UNIVERSITY OF CALIFORNIA
REGENTS OF THE UNI OF CA,REGENTS OF THE UNIVERSITY OF CALIFORNIA
REGENTS OF THE UNIV OF CA,REGENTS OF THE UNIVERSITY OF CALIFORNIA
REGENTS OF THE UNIV OF CALIF,REGENTS OF THE UNIVERSITY OF CALIFORNIA
REGENTS OF THE UNIV. OF CA,REGENTS OF THE UNIVERSITY OF CALIFORNIA
REGENTS OF THE UNIVERSITY OF CA,REGENTS OF THE UNIVERSITY OF CALIFORNIA
REGENTS OF THE UNIVERSITY OF CALIFORNIA /C,REGENTS OF THE UNIVERSITY OF CALIFORNIA
REGENTS OF UC,REGENTS OF THE UNIVERSITY OF CALIFORNIA
REGENTS OF UNIVERSITY OF CA,REGENTS OF THE UNIVERSITY OF CALIFORNIA
REGENTS OF UNIVERSITY OF CALIFORNIA,REGENTS OF THE UNIVERSITY OF CALIFORNIA
"REYES CONSTRUCTION, INC.","REYES CONSTRUCTION, INC"
REYES CONSTRUCTION INC.,"REYES CONSTRUCTION, INC"
REYES CONSTRUCTION INC,"REYES CONSTRUCTION, INC"
SOUTHERN CALIFORNIA GAS,SOUTHERN CALIFORNIA GAS COMPANY
SOUTHERN CALIFORNIA GAS CO,SOUTHERN CALIFORNIA GAS COMPANY
SOUTHERN CALIFORNIA GAS CO /C,SOUTHERN CALIFORNIA GAS COMPANY
SOUTHERN CALIFORNIA GAS CO.,SOUTHERN CALIFORNIA GAS COMPANY
